{
  "id": "intent-1781753126-tg-?",
  "type": "scalp",
  "address": "FkghcPm6fnctAiPtod5HrtTjrjkBrT3X49Ld19jyBAGS",
  "symbol": "?",
  "signal": "TG signal from memtrade",
  "conviction": 0.3,
  "action": "analyze",
  "context": "Telegram signal: ",
  "bucket": "scalp",
  "source": "tg-calls",
  "metadata": {
    "source": "memtrade",
    "name": ""
  },
  "timestamp": "2026-06-18T11:25:26.005665Z"
}